Nike Air Force 1 Mid LV8 Next Nature; Nike; Preto
Nike Air Max Plus; Nike; Preto
Nike Air Max SC; Nike; Branco
Nike Air Force 1 Low; Nike; Branco
Nike Air Max 270; Nike; Preto
Nike Air Vapormax Plus; Branco
Nike Air Max 97; Nike; Preto
Adidas NMD R1; Adidas; Branco
Nike Air Max 90; Nike; Preto
Nike Air Vapormax Flyknit 3; Nike; Preto
Jordan I High OG; Jordan; Vermelho
Jordan XIII; Jordan; Vermelho
Asics Gel Excite; Asics; Preto
Adidas Coreracer; Adidas; Branco
Fila Float Maxxi; Fila; Azul
Olympikus Bravo; Olympicus; Azul
Nike Revolution; Nike; Preto
Mizuno Space; Mizuno; Azul
Asics Shogun; Asics; Preto
Adidas Lite Racer; Adidas; Branco
Adidas Run Falcon; Adidas; Branco
Asics Raiden; Asics; Preto
Olympikus Wellness; Olympicus; Azul
Asics Cumulus; Asics; Preto
Nike VaporMax; Nike; Preto